{"_purpose":"Single source of truth for component versions across the system. The dashboard reads from the embedded copy of this; tools/version_bump.py is the only sanctioned writer. Versions display in: the dashboard top banner pill, the Creator's Log sysinfo grid, the backup-file naming convention, and saga round entries. Synchronizing them used to be manual and got forgotten ~10 times since 2026-06-13 \u2014 this file fixes that.","current":{"brain":"3.27","brain_label":"Design System v3 \u2014 Phase 0 foundation","dashboard":"1.106","dashboard_label":"HBSP restore button \u2014 Eden-aware + adopted-detection","updated_iso":"2026-06-21","updated_display":"2026-06-21"},"bump_policy":"Increment when a Pass/Round lands that warrants a rollback point. Dashboard minor bumps per Pass (substantive UI or data architecture change). Brain minor bumps per protocol/discipline/tool-surface change. Major bumps reserved for paradigm shifts (e.g., a new tile kind, a new memory architecture).","backup_convention":"dashboard-v{dashboard}-{date}.html and brain-v{brain}-{date}.md. The version_bump tool writes to versions.json which the dashboard reads on load. Manual backup files should mirror the version current at time of backup.","history":[{"round":160,"date":"2026-06-21","brain":"3.27","dashboard":"1.106","summary":"brain v3.27 \u2014 Design System v3 \u2014 Phase 0 foundation"},{"round":159,"date":"2026-06-20","brain":"3.26","dashboard":"1.106","summary":"brain v3.26 \u2014 Round 159 \u2014 \u00a732 whack-a-mole rebuild trigger doctrine + Vision/Aegis proposal recorded"},{"round":158,"date":"2026-06-20","brain":"3.25","dashboard":"1.106","summary":"brain v3.25 \u2014 Round 158 wrap \u2014 dose UX + card restructure + HBSP restore"},{"round":157,"date":"2026-06-20","brain":"3.24","dashboard":"1.106","summary":"dashboard v1.106 \u2014 HBSP restore button \u2014 Eden-aware + adopted-detection"},{"round":156,"date":"2026-06-20","brain":"3.23","dashboard":"1.101","summary":"dashboard v1.101 \u2014 Zombie items fix \u2014 kind gate + Unadopt cleanup + stale-override migration"},{"round":155,"date":"2026-06-20","brain":"3.22","dashboard":"1.90","summary":"dashboard v1.90 \u2014 Path B \u2014 goal-engine items wired to label lookup"},{"round":154,"date":"2026-06-19","brain":"3.20","dashboard":"1.89","summary":"dashboard v1.89 \u2014 Bug E Path C \u2014 curated framing for goal-driven adopts"},{"round":153,"date":"2026-06-19","brain":"3.20","dashboard":"1.88","summary":"dashboard v1.88 \u2014 Bug B \u2014 hard-delete for scanner-sourced items"},{"round":152,"date":"2026-06-19","brain":"3.20","dashboard":"1.87","summary":"dashboard v1.87 \u2014 Bug C \u2014 esc/escapeHtml cross-IIFE fix"},{"round":151,"date":"2026-06-19","brain":"3.20","dashboard":"1.86","summary":"dashboard v1.86 \u2014 Bug A \u2014 \u00a731 cascade completion"},{"round":150,"date":"2026-06-19","brain":"3.20","dashboard":"1.85","summary":"dashboard v1.85 \u2014 Cross-Surface State Sync chokepoint"},{"round":149,"date":"2026-06-19","brain":"3.20","dashboard":"1.84","summary":"dashboard v1.84 \u2014 Round 141 regression fix"},{"round":148,"date":"2026-06-19","brain":"3.20","dashboard":"1.83","summary":"brain v3.20 \u2014 Closing the logging loop"},{"round":147,"date":"2026-06-19","brain":"3.18","dashboard":"1.83","summary":"Sim-finding patches \u2014 Cura translation-quality cap + verified-pattern output-shape + Vision HARD CAP promotion + sim rubric Phase numbering","narrative_only":true},{"round":146,"date":"2026-06-19","brain":"3.18","dashboard":"1.83","summary":"Tacitus simulation harness \u2014 tools/tacitus_simulate.py with /tmp-only safety + purge command","narrative_only":true},{"round":145,"date":"2026-06-19","brain":"3.18","dashboard":"1.83","summary":"Dribbble + CodePen canonical sources \u2014 co-work design workflow doc + protocols \u00a729 + design-knowledge Rule 1 expansion + Vision search-term field","narrative_only":true},{"round":144,"date":"2026-06-19","brain":"3.18","dashboard":"1.83","summary":"Vision pattern-seed compliance + verified-patterns cross-references","narrative_only":true},{"round":143,"date":"2026-06-19","brain":"3.18","dashboard":"1.83","summary":"vision-default-regimen Phase 6 atomic close","narrative_only":true},{"round":142,"date":"2026-06-19","brain":"3.18","dashboard":"1.83","summary":"Discipline-tightening batch (C-A through R141 fix)","narrative_only":true},{"round":141,"date":"2026-06-19","brain":"3.18","dashboard":"1.83","summary":"dashboard v1.83 \u2014 Goal-driven recommendations engine"},{"round":140,"date":"2026-06-19","brain":"3.18","dashboard":"1.82","summary":"brain v3.18 \u2014 Verified Patterns System","tacitus_bump":"v2.5"},{"round":139,"date":"2026-06-19","brain":"3.17","dashboard":"1.82","summary":"dashboard v1.82 \u2014 Toggle parameter tuning + scanner form bg"},{"round":138,"date":"2026-06-19","brain":"3.17","dashboard":"1.75","summary":"dashboard v1.75 \u2014 Cart-share primitive + New Regimen flow"},{"round":137,"date":"2026-06-19","brain":"3.17","dashboard":"1.74","summary":"Parser drift caught at the gate","narrative_only":true},{"round":129,"date":"2026-06-18","brain":"3.15","dashboard":"1.67","summary":"Delete button finally works","narrative_only":true},{"round":128,"date":"2026-06-18","brain":"3.15","dashboard":"1.67","summary":"dashboard v1.67 \u2014 Pass F substrate refresh"},{"round":127,"date":"2026-06-18","brain":"3.15","dashboard":"1.66","summary":"dashboard v1.66 \u2014 Pass F polish"},{"round":126,"date":"2026-06-18","brain":"3.15","dashboard":"1.65","summary":"dashboard v1.65 \u2014 Save cartridge shipped"},{"round":125,"date":"2026-06-18","brain":"3.15","dashboard":"1.64","summary":"Footgun closed, slate cleared","narrative_only":true},{"round":124,"date":"2026-06-18","brain":"3.15","dashboard":"1.64","summary":"dashboard v1.64 \u2014 Wallach speaks fuller when asked"},{"round":123,"date":"2026-06-18","brain":"3.15","dashboard":"1.63","summary":"dashboard v1.63 \u2014 Phase 3 complete: 92 stances"},{"round":122,"date":"2026-06-18","brain":"3.15","dashboard":"1.62","summary":"dashboard v1.62 \u2014 Wallach speaks: 15 stances live"},{"round":121,"date":"2026-06-18","brain":"3.15","dashboard":"1.61","summary":"Match keys tolerate formatting noise","narrative_only":true},{"round":120,"date":"2026-06-18","brain":"3.15","dashboard":"1.61","summary":"Discipline, not just rules","narrative_only":true},{"round":119,"date":"2026-06-18","brain":"3.15","dashboard":"1.61","summary":"Vision speaks twice","narrative_only":true,"tacitus_bump":"v2.3"},{"round":118,"date":"2026-06-18","brain":"3.15","dashboard":"1.61","summary":"Cura speaks twice","narrative_only":true},{"round":117,"date":"2026-06-18","brain":"3.15","dashboard":"1.61","summary":"Dashboard refreshes itself","narrative_only":true},{"round":116,"date":"2026-06-17","brain":"3.15","dashboard":"1.61","summary":"Corpus speaks for the essentials","narrative_only":true},{"round":115,"date":"2026-06-17","brain":"3.15","dashboard":"1.61","summary":"dashboard v1.61 \u2014 Where the framework speaks"},{"round":114,"date":"2026-06-17","brain":"3.15","dashboard":"1.60","summary":"Modal speaks its source's color","narrative_only":true},{"round":113,"date":"2026-06-17","brain":"3.15","dashboard":"1.60","summary":"Vision Survivor B Path B \u2014 Cura-only Phase 0 (READ-only)","narrative_only":true},{"round":112,"date":"2026-06-17","brain":"3.15","dashboard":"1.60","summary":"Reflection: first Vision finding lands; luck-vs-process calibration noted; calendar-redundancy filed","narrative_only":true},{"round":111,"date":"2026-06-17","brain":"3.15","dashboard":"1.60","summary":"Vision Survivor A executed \u2014 The Trend sparkline strip across cycles","narrative_only":true},{"round":110,"date":"2026-06-17","brain":"3.15","dashboard":"1.60","summary":"Implementation crystals on Aegis verdict cards \u2014 session aggregate via build-time projection","narrative_only":true},{"round":109,"date":"2026-06-17","brain":"3.15","dashboard":"1.60","summary":"Implementation crystals polish \u2014 semantic colors, click-for-modal, layout fix","narrative_only":true},{"round":108,"date":"2026-06-17","brain":"3.15","dashboard":"1.60","summary":"brain v3.15 \u2014 Each finding's fate, visible"},{"round":107,"date":"2026-06-17","brain":"3.14","dashboard":"1.60","summary":"brain v3.14 \u2014 Cura's findings, executed"},{"round":106,"date":"2026-06-17","brain":"3.13","dashboard":"1.60","summary":"brain v3.13 \u2014 Each task, its own scratch"},{"round":105,"date":"2026-06-17","brain":"3.12","dashboard":"1.60","summary":"brain v3.12 \u2014 Vitality lapses persist"},{"round":104,"date":"2026-06-17","brain":"3.11","dashboard":"1.60","summary":"brain v3.11 \u2014 Round numbers from the saga"},{"round":103,"date":"2026-06-17","brain":"3.10","dashboard":"1.60","summary":"Tacitus live observation surface activated; demo retired; UX iteration","narrative_only":true,"tacitus_bump":"v2.1 \u2192 v2.2"},{"round":102,"date":"2026-06-17","brain":"3.10","dashboard":"1.60","summary":"dashboard v1.60 \u2014 Honest dietary baseline"},{"round":101,"date":"2026-06-16","brain":"3.10","dashboard":"1.59","summary":"Tacitus dashboard shipped \u2014 standalone surface, demo phase","narrative_only":true,"tacitus_bump":"v2.0 \u2192 v2.1"},{"round":100,"date":"2026-06-16","brain":"3.10","dashboard":"1.59","summary":"dashboard v1.59 \u2014 Cura, Vision, Aegis"},{"round":99,"date":"2026-06-16","brain":"3.10","dashboard":"1.58","summary":"Coverage from one source \u2014 pipeline unified, ESSENTIALS retired, Youngevity/Wallach two-role split codified"},{"round":98,"date":"2026-06-16","brain":"3.10","dashboard":"1.55","summary":"brain v3.10 \u2014 Round 98 \u2014 Catch-up response ordering protocol (Tacitus surface first among substantive items, size-aware presentation, open-threads as one-line reminders); tacitus YYYY-MM notebook added to catch-up read list + catchup_seal; confirm-or-deny discipline codified"},{